{
  "sample_id": "418d4bf8-7e9b-51a2-95ab-f1fe1c28016e",
  "dataset_id": "D11",
  "asset_ids": [
    "90ab2170-4686-52ec-8160-d26921fe346a"
  ],
  "source_group_ids": [
    "synthetic-v1"
  ],
  "source_authorization_ref": "synthetic-fixture-only-not-business-authority",
  "annotation_version": "synthetic-v1",
  "annotation_status": "reviewed",
  "reviewer_refs": [
    "synthetic-v1"
  ],
  "quality_tags": [],
  "payload": {
    "query_asset_id": "b87b184c-d065-5b5a-8a97-1791175ce327",
    "mappings": [
      {
        "source_asset_id": "234084e1-a9bb-5e45-8bcf-bad587c74bd4",
        "query_range": {
          "start_ms": 0,
          "end_ms": 1000
        },
        "source_range": {
          "start_ms": 0,
          "end_ms": 1000
        },
        "direction": "forward",
        "speed_ratio": 1.0
      },
      {
        "source_asset_id": "4e69a0ed-510c-536a-a4d3-080dfc91a592",
        "query_range": {
          "start_ms": 0,
          "end_ms": 1000
        },
        "source_range": {
          "start_ms": 0,
          "end_ms": 1000
        },
        "direction": "forward",
        "speed_ratio": 1.0
      }
    ],
    "unknown_ranges": []
  }
}
